component,raw_value,normalized_score,audit_note
statement_specificity,188,0.447619,Longer problem statements usually expose more constraints for a first-pass model.
numeric_anchor_count,0,0.0,Counts numeric anchors visible in the question statement and method hint.
model_keyword_match,5,1.0,Measures how clearly the question maps to a classical modeling family.
source_strength,official_pdf_and_world_bank_api,0.92,Rewards official attachments and explicit official statement parameters.
artifact_readiness,question_artifacts/2023/F-GreenGDP/q05/green_gdp_policy_frontier.png,0.68,Rewards table-like artifacts that a baseline can inspect directly.
