policy,wildlife_protection_gain,resident_benefit_gain,conflict_reduction,tourism_revenue_gain,governance_feasibility,implementation_cost_index,ecological_score,resident_score,economic_score,composite_score
compensation and predator-proof livestock program,0.11,0.26,0.34,0.07,0.73,0.38,0.2708,0.3545,0.2344,0.1945
community conservancy revenue sharing,0.18,0.31,0.23,0.18,0.77,0.49,0.285,0.3561,0.3174,0.1934
integrated mosaic plan,0.3,0.33,0.35,0.21,0.7,0.62,0.3834,0.3961,0.327,0.1907
restoration buffer and voluntary easements,0.25,0.22,0.28,0.13,0.67,0.55,0.3376,0.3177,0.2488,0.1469
baseline enforcement only,0.04,0.02,0.03,0.03,0.8,0.18,0.1558,0.1457,0.1662,0.1453
strict core zoning plus visitor caps,0.22,0.09,0.15,0.1,0.64,0.42,0.289,0.2137,0.1948,0.1173
